"alt","caption","childPosts/0/alt","childPosts/0/caption","childPosts/0/commentsCount","childPosts/0/dimensionsHeight","childPosts/0/dimensionsWidth","childPosts/0/displayUrl","childPosts/0/firstComment","childPosts/0/id","childPosts/0/likesCount","childPosts/0/ownerId","childPosts/0/shortCode","childPosts/0/taggedUsers/0/full_name","childPosts/0/taggedUsers/0/id","childPosts/0/taggedUsers/0/is_verified","childPosts/0/taggedUsers/0/profile_pic_url","childPosts/0/taggedUsers/0/username","childPosts/0/taggedUsers/1/full_name","childPosts/0/taggedUsers/1/id","childPosts/0/taggedUsers/1/is_verified","childPosts/0/taggedUsers/1/profile_pic_url","childPosts/0/taggedUsers/1/username","childPosts/0/timestamp","childPosts/0/type","childPosts/0/url","childPosts/0/videoPlayCount","childPosts/0/videoUrl","childPosts/0/videoViewCount","childPosts/1/alt","childPosts/1/caption","childPosts/1/commentsCount","childPosts/1/dimensionsHeight","childPosts/1/dimensionsWidth","childPosts/1/displayUrl","childPosts/1/firstComment","childPosts/1/id","childPosts/1/likesCount","childPosts/1/ownerId","childPosts/1/shortCode","childPosts/1/timestamp","childPosts/1/type","childPosts/1/url","childPosts/2/alt","childPosts/2/caption","childPosts/2/commentsCount","childPosts/2/dimensionsHeight","childPosts/2/dimensionsWidth","childPosts/2/displayUrl","childPosts/2/firstComment","childPosts/2/id","childPosts/2/likesCount","childPosts/2/ownerId","childPosts/2/shortCode","childPosts/2/taggedUsers/0/full_name","childPosts/2/taggedUsers/0/id","childPosts/2/taggedUsers/0/is_verified","childPosts/2/taggedUsers/0/profile_pic_url","childPosts/2/taggedUsers/0/username","childPosts/2/timestamp","childPosts/2/type","childPosts/2/url","childPosts/3/alt","childPosts/3/caption","childPosts/3/commentsCount","childPosts/3/dimensionsHeight","childPosts/3/dimensionsWidth","childPosts/3/displayUrl","childPosts/3/firstComment","childPosts/3/id","childPosts/3/likesCount","childPosts/3/ownerId","childPosts/3/shortCode","childPosts/3/taggedUsers/0/full_name","childPosts/3/taggedUsers/0/id","childPosts/3/taggedUsers/0/is_verified","childPosts/3/taggedUsers/0/profile_pic_url","childPosts/3/taggedUsers/0/username","childPosts/3/timestamp","childPosts/3/type","childPosts/3/url","childPosts/4/alt","childPosts/4/caption","childPosts/4/commentsCount","childPosts/4/dimensionsHeight","childPosts/4/dimensionsWidth","childPosts/4/displayUrl","childPosts/4/firstComment","childPosts/4/id","childPosts/4/likesCount","childPosts/4/ownerId","childPosts/4/shortCode","childPosts/4/timestamp","childPosts/4/type","childPosts/4/url","childPosts/5/alt","childPosts/5/caption","childPosts/5/commentsCount","childPosts/5/dimensionsHeight","childPosts/5/dimensionsWidth","childPosts/5/displayUrl","childPosts/5/firstComment","childPosts/5/id","childPosts/5/likesCount","childPosts/5/ownerId","childPosts/5/shortCode","childPosts/5/taggedUsers/0/full_name","childPosts/5/taggedUsers/0/id","childPosts/5/taggedUsers/0/is_verified","childPosts/5/taggedUsers/0/profile_pic_url","childPosts/5/taggedUsers/0/username","childPosts/5/timestamp","childPosts/5/type","childPosts/5/url","childPosts/6/alt","childPosts/6/caption","childPosts/6/commentsCount","childPosts/6/dimensionsHeight","childPosts/6/dimensionsWidth","childPosts/6/displayUrl","childPosts/6/firstComment","childPosts/6/id","childPosts/6/likesCount","childPosts/6/ownerId","childPosts/6/shortCode","childPosts/6/timestamp","childPosts/6/type","childPosts/6/url","childPosts/7/alt","childPosts/7/caption","childPosts/7/commentsCount","childPosts/7/dimensionsHeight","childPosts/7/dimensionsWidth","childPosts/7/displayUrl","childPosts/7/firstComment","childPosts/7/id","childPosts/7/likesCount","childPosts/7/ownerId","childPosts/7/shortCode","childPosts/7/taggedUsers/0/full_name","childPosts/7/taggedUsers/0/id","childPosts/7/taggedUsers/0/is_verified","childPosts/7/taggedUsers/0/profile_pic_url","childPosts/7/taggedUsers/0/username","childPosts/7/timestamp","childPosts/7/type","childPosts/7/url","childPosts/8/alt","childPosts/8/caption","childPosts/8/commentsCount","childPosts/8/dimensionsHeight","childPosts/8/dimensionsWidth","childPosts/8/displayUrl","childPosts/8/firstComment","childPosts/8/id","childPosts/8/likesCount","childPosts/8/ownerId","childPosts/8/shortCode","childPosts/8/timestamp","childPosts/8/type","childPosts/8/url","childPosts/9/alt","childPosts/9/caption","childPosts/9/commentsCount","childPosts/9/dimensionsHeight","childPosts/9/dimensionsWidth","childPosts/9/displayUrl","childPosts/9/firstComment","childPosts/9/id","childPosts/9/likesCount","childPosts/9/ownerId","childPosts/9/shortCode","childPosts/9/taggedUsers/0/full_name","childPosts/9/taggedUsers/0/id","childPosts/9/taggedUsers/0/is_verified","childPosts/9/taggedUsers/0/profile_pic_url","childPosts/9/taggedUsers/0/username","childPosts/9/taggedUsers/1/full_name","childPosts/9/taggedUsers/1/id","childPosts/9/taggedUsers/1/is_verified","childPosts/9/taggedUsers/1/profile_pic_url","childPosts/9/taggedUsers/1/username","childPosts/9/timestamp","childPosts/9/type","childPosts/9/url","coauthorProducers/0/id","coauthorProducers/0/is_verified","coauthorProducers/0/profile_pic_url","coauthorProducers/0/username","coauthorProducers/1/id","coauthorProducers/1/is_verified","coauthorProducers/1/profile_pic_url","coauthorProducers/1/username","coauthorProducers/2/id","coauthorProducers/2/is_verified","coauthorProducers/2/profile_pic_url","coauthorProducers/2/username","commentsCount","dimensionsHeight","dimensionsWidth","displayUrl","firstComment","hashtags/0","hashtags/1","hashtags/2","hashtags/3","hashtags/4","hashtags/5","hashtags/6","hashtags/7","hashtags/8","hashtags/9","hashtags/10","hashtags/11","hashtags/12","hashtags/13","hashtags/14","hashtags/15","hashtags/16","hashtags/17","hashtags/18","hashtags/19","hashtags/20","hashtags/21","hashtags/22","hashtags/23","hashtags/24","hashtags/25","hashtags/26","hashtags/27","id","images/0","images/1","images/2","images/3","images/4","images/5","images/6","images/7","images/8","images/9","inputUrl","isPinned","isSponsored","latestComments/0/id","latestComments/0/likesCount","latestComments/0/ownerProfilePicUrl","latestComments/0/ownerUsername","latestComments/0/replies/0/id","latestComments/0/replies/0/likesCount","latestComments/0/replies/0/ownerProfilePicUrl","latestComments/0/replies/0/ownerUsername","latestComments/0/replies/0/repliesCount","latestComments/0/replies/0/text","latestComments/0/replies/0/timestamp","latestComments/0/replies/1/id","latestComments/0/replies/1/likesCount","latestComments/0/replies/1/ownerProfilePicUrl","latestComments/0/replies/1/ownerUsername","latestComments/0/replies/1/repliesCount","latestComments/0/replies/1/text","latestComments/0/replies/1/timestamp","latestComments/0/repliesCount","latestComments/0/text","latestComments/0/timestamp","latestComments/1/id","latestComments/1/likesCount","latestComments/1/ownerProfilePicUrl","latestComments/1/ownerUsername","latestComments/1/replies/0/id","latestComments/1/replies/0/likesCount","latestComments/1/replies/0/ownerProfilePicUrl","latestComments/1/replies/0/ownerUsername","latestComments/1/replies/0/repliesCount","latestComments/1/replies/0/text","latestComments/1/replies/0/timestamp","latestComments/1/replies/1/id","latestComments/1/replies/1/likesCount","latestComments/1/replies/1/ownerProfilePicUrl","latestComments/1/replies/1/ownerUsername","latestComments/1/replies/1/repliesCount","latestComments/1/replies/1/text","latestComments/1/replies/1/timestamp","latestComments/1/repliesCount","latestComments/1/text","latestComments/1/timestamp","latestComments/2/id","latestComments/2/likesCount","latestComments/2/ownerProfilePicUrl","latestComments/2/ownerUsername","latestComments/2/replies/0/id","latestComments/2/replies/0/likesCount","latestComments/2/replies/0/ownerProfilePicUrl","latestComments/2/replies/0/ownerUsername","latestComments/2/replies/0/repliesCount","latestComments/2/replies/0/text","latestComments/2/replies/0/timestamp","latestComments/2/repliesCount","latestComments/2/text","latestComments/2/timestamp","latestComments/3/id","latestComments/3/likesCount","latestComments/3/ownerProfilePicUrl","latestComments/3/ownerUsername","latestComments/3/replies/0/id","latestComments/3/replies/0/likesCount","latestComments/3/replies/0/ownerProfilePicUrl","latestComments/3/replies/0/ownerUsername","latestComments/3/replies/0/repliesCount","latestComments/3/replies/0/text","latestComments/3/replies/0/timestamp","latestComments/3/repliesCount","latestComments/3/text","latestComments/3/timestamp","latestComments/4/id","latestComments/4/likesCount","latestComments/4/ownerProfilePicUrl","latestComments/4/ownerUsername","latestComments/4/replies/0/id","latestComments/4/replies/0/likesCount","latestComments/4/replies/0/ownerProfilePicUrl","latestComments/4/replies/0/ownerUsername","latestComments/4/replies/0/repliesCount","latestComments/4/replies/0/text","latestComments/4/replies/0/timestamp","latestComments/4/repliesCount","latestComments/4/text","latestComments/4/timestamp","latestComments/5/id","latestComments/5/likesCount","latestComments/5/ownerProfilePicUrl","latestComments/5/ownerUsername","latestComments/5/replies/0/id","latestComments/5/replies/0/likesCount","latestComments/5/replies/0/ownerProfilePicUrl","latestComments/5/replies/0/ownerUsername","latestComments/5/replies/0/repliesCount","latestComments/5/replies/0/text","latestComments/5/replies/0/timestamp","latestComments/5/repliesCount","latestComments/5/text","latestComments/5/timestamp","latestComments/6/id","latestComments/6/likesCount","latestComments/6/ownerProfilePicUrl","latestComments/6/ownerUsername","latestComments/6/replies/0/id","latestComments/6/replies/0/likesCount","latestComments/6/replies/0/ownerProfilePicUrl","latestComments/6/replies/0/ownerUsername","latestComments/6/replies/0/repliesCount","latestComments/6/replies/0/text","latestComments/6/replies/0/timestamp","latestComments/6/repliesCount","latestComments/6/text","latestComments/6/timestamp","latestComments/7/id","latestComments/7/likesCount","latestComments/7/ownerProfilePicUrl","latestComments/7/ownerUsername","latestComments/7/replies/0/id","latestComments/7/replies/0/likesCount","latestComments/7/replies/0/ownerProfilePicUrl","latestComments/7/replies/0/ownerUsername","latestComments/7/replies/0/repliesCount","latestComments/7/replies/0/text","latestComments/7/replies/0/timestamp","latestComments/7/repliesCount","latestComments/7/text","latestComments/7/timestamp","latestComments/8/id","latestComments/8/likesCount","latestComments/8/ownerProfilePicUrl","latestComments/8/ownerUsername","latestComments/8/replies/0/id","latestComments/8/replies/0/likesCount","latestComments/8/replies/0/ownerProfilePicUrl","latestComments/8/replies/0/ownerUsername","latestComments/8/replies/0/repliesCount","latestComments/8/replies/0/text","latestComments/8/replies/0/timestamp","latestComments/8/repliesCount","latestComments/8/text","latestComments/8/timestamp","latestComments/9/id","latestComments/9/likesCount","latestComments/9/ownerProfilePicUrl","latestComments/9/ownerUsername","latestComments/9/repliesCount","latestComments/9/text","latestComments/9/timestamp","likesCount","locationId","locationName","mentions/0","mentions/1","mentions/2","mentions/3","musicInfo/artist_name","musicInfo/audio_id","musicInfo/should_mute_audio","musicInfo/should_mute_audio_reason","musicInfo/song_name","musicInfo/uses_original_audio","ownerFullName","ownerId","ownerUsername","paidPartnership","productType","shortCode","taggedUsers/0/full_name","taggedUsers/0/id","taggedUsers/0/is_verified","taggedUsers/0/profile_pic_url","taggedUsers/0/username","taggedUsers/1/full_name","taggedUsers/1/id","taggedUsers/1/is_verified","taggedUsers/1/profile_pic_url","taggedUsers/1/username","taggedUsers/2/full_name","taggedUsers/2/id","taggedUsers/2/is_verified","taggedUsers/2/profile_pic_url","taggedUsers/2/username","taggedUsers/3/full_name","taggedUsers/3/id","taggedUsers/3/is_verified","taggedUsers/3/profile_pic_url","taggedUsers/3/username","taggedUsers/4/full_name","taggedUsers/4/id","taggedUsers/4/is_verified","taggedUsers/4/profile_pic_url","taggedUsers/4/username","taggedUsers/5/full_name","taggedUsers/5/id","taggedUsers/5/is_verified","taggedUsers/5/profile_pic_url","taggedUsers/5/username","taggedUsers/6/full_name","taggedUsers/6/id","taggedUsers/6/is_verified","taggedUsers/6/profile_pic_url","taggedUsers/6/username","timestamp","type","url","videoDuration","videoPlayCount","videoUrl","videoViewCount"
,"My festive shopping is all set with Fabindia! 

If you’re on the hunt for stylish yet comfortable ethnic wear, I highly recommend exploring Fabindia’s Svarnim collection. I personally fell in love with their white silk kurta featuring intricate printed design. I have paired it with maroon silk woven dupatta to add a touch of elegance to my festive look!

Here’s all you need to check out at their newly opened Guntur store: 

- Handwoven saris that stole my heart
- Exquisite silver jewellery that shine
- Thoughtful gifting options

📍Fabindia, Lakshmipuram, Main Road, Naidupet, Guntur.

They also have a branch in Vijayawada, so be sure to visit!

#Fabindia #FestiveFashion #EthnicWear #SvarnimCollection #KurtiLove #FabindiaGuntur #FabindiaVijayawada #celebrateindia #vijayawada #trending #viral #goviral #explore #fashion #festivalcollection",,,,,,,,,,,,,,,,,,,,,,,,,,,,,,,,,,,,,,,,,,,,,,,,,,,,,,,,,,,,,,,,,,,,,,,,,,,,,,,,,,,,,,,,,,,,,,,,,,,,,,,,,,,,,,,,,,,,,,,,,,,,,,,,,,,,,,,,,,,,,,,,,,,,,,,,,,,,,,,,,,,,,,,,,,,,,,,,,,,,,,,,"2262456598","true","https://scontent-man2-1.cdninstagram.com/v/t51.2885-19/432332762_945011700073211_7674563442113092029_n.jpg?stp=dst-jpg_s150x150&_nc_ht=scontent-man2-1.cdninstagram.com&_nc_cat=111&_nc_ohc=xVzFO5fD9UcQ7kNvgEQon65&_nc_gid=a4776ddf2f4d4c8cb42941167bd9de95&edm=APs17CUBAAAA&ccb=7-5&oh=00_AYBe2qhRpJQHReoYIGRSmRHeQv6-u8T1aT5xONSdBkbKXQ&oe=672189BC&_nc_sid=10d13b","fabindiahome","1905097744","true","https://scontent-man2-1.cdninstagram.com/v/t51.2885-19/454154136_518249137418791_7238993056886277693_n.jpg?stp=dst-jpg_s150x150&_nc_ht=scontent-man2-1.cdninstagram.com&_nc_cat=1&_nc_ohc=nA5j2rC6QxAQ7kNvgEXfCi-&_nc_gid=a4776ddf2f4d4c8cb42941167bd9de95&edm=APs17CUBAAAA&ccb=7-5&oh=00_AYDyAJnqiDy28qCwyv3pt_Sw_nKhE5l1HF9detKu4-eeWA&oe=6721B762&_nc_sid=10d13b","fabindiaofficial",,,,,"1","1918","1080","https://scontent-man2-1.cdninstagram.com/v/t51.29350-15/464065385_1053428356071749_6254262278407035261_n.jpg?stp=dst-jpg_e35_p1080x1080_sh0.08&_nc_ht=scontent-man2-1.cdninstagram.com&_nc_cat=105&_nc_ohc=74sM3-9LgFMQ7kNvgFNEoUA&_nc_gid=a4776ddf2f4d4c8cb42941167bd9de95&edm=APs17CUBAAAA&ccb=7-5&oh=00_AYDWji6ihmzZn4TvUOy4tvlW6n-TyZiEYrrqwqxzAbeBNQ&oe=67218BCC&_nc_sid=10d13b","😮😮","Fabindia","FestiveFashion","EthnicWear","SvarnimCollection","KurtiLove","FabindiaGuntur","FabindiaVijayawada","celebrateindia","vijayawada","trending","viral","goviral","explore","fashion","festivalcollection",,,,,,,,,,,,,,"3482319647570138125",,,,,,,,,,,"https://www.instagram.com/fabindiaofficial/",,"false","18039418940472947","0","https://scontent-man2-1.cdninstagram.com/v/t51.2885-19/365388303_298062562773748_3818968152552357839_n.jpg?stp=dst-jpg_s150x150&_nc_ht=scontent-man2-1.cdninstagram.com&_nc_cat=104&_nc_ohc=hLp_7T4fuqoQ7kNvgEvuZ0c&_nc_gid=a4776ddf2f4d4c8cb42941167bd9de95&edm=APs17CUBAAAA&ccb=7-5&oh=00_AYBMPU5ihaID_kAhU7JjzUapSWgrZAcizobJg7_zU6ZGIg&oe=6721ACBE&_nc_sid=10d13b","sivalanka_prabhakar",,,,,,,,,,,,,,,"0","😮😮","2024-10-21T07:21:23.000Z",,,,,,,,,,,,,,,,,,,,,,,,,,,,,,,,,,,,,,,,,,,,,,,,,,,,,,,,,,,,,,,,,,,,,,,,,,,,,,,,,,,,,,,,,,,,,,,,,,,,,,,,,,,,,,,,,,,,,,,,,,,,,,,"278",,,,,,,"divya_deevi","926663769305241","false","","Original audio","true","Dhee_vya❤️","3071650749","divya_deevi",,"clips","DBTr0TzyBQN","Fabindia","1905097744","true","https://scontent-man2-1.cdninstagram.com/v/t51.2885-19/454154136_518249137418791_7238993056886277693_n.jpg?stp=dst-jpg_s150x150&_nc_ht=scontent-man2-1.cdninstagram.com&_nc_cat=1&_nc_ohc=nA5j2rC6QxAQ7kNvgEXfCi-&_nc_gid=a4776ddf2f4d4c8cb42941167bd9de95&edm=APs17CUBAAAA&ccb=7-5&oh=00_AYDyAJnqiDy28qCwyv3pt_Sw_nKhE5l1HF9detKu4-eeWA&oe=6721B762&_nc_sid=10d13b","fabindiaofficial","Fabindia Home & Lifestyle","2262456598","true","https://scontent-man2-1.cdninstagram.com/v/t51.2885-19/432332762_945011700073211_7674563442113092029_n.jpg?stp=dst-jpg_s150x150&_nc_ht=scontent-man2-1.cdninstagram.com&_nc_cat=111&_nc_ohc=xVzFO5fD9UcQ7kNvgEQon65&_nc_gid=a4776ddf2f4d4c8cb42941167bd9de95&edm=APs17CUBAAAA&ccb=7-5&oh=00_AYBe2qhRpJQHReoYIGRSmRHeQv6-u8T1aT5xONSdBkbKXQ&oe=672189BC&_nc_sid=10d13b","fabindiahome",,,,,,,,,,,,,,,,,,,,,,,,,,"2024-10-19T13:36:18.000Z","Video","https://www.instagram.com/p/DBTr0TzyBQN/","52.1","27377","https://scontent-man2-1.cdninstagram.com/o1/v/t16/f1/m86/514FBE104191570EE202034970A660B4_video_dashinit.mp4?stp=dst-mp4&efg=eyJxZV9ncm91cHMiOiJbXCJpZ193ZWJfZGVsaXZlcnlfdnRzX290ZlwiXSIsInZlbmNvZGVfdGFnIjoidnRzX3ZvZF91cmxnZW4uY2xpcHMuYzIuNzIwLmJhc2VsaW5lIn0&_nc_cat=105&vs=394603893703126_4085688354&_nc_vs=HBksFQIYUmlnX3hwdl9yZWVsc19wZXJtYW5lbnRfc3JfcHJvZC81MTRGQkUxMDQxOTE1NzBFRTIwMjAzNDk3MEE2NjBCNF92aWRlb19kYXNoaW5pdC5tcDQVAALIAQAVAhg6cGFzc3Rocm91Z2hfZXZlcnN0b3JlL0dIbmJvaHR3NndpVDQ2QWRBSmI1WVY4bGx0VXhicV9FQUFBRhUCAsgBACgAGAAbABUAACbInO2FzY%2FqPxUCKAJDMywXQEoMzMzMzM0YEmRhc2hfYmFzZWxpbmVfMV92MREAdf4HAA%3D%3D&_nc_rid=a4776953ac&ccb=9-4&oh=00_AYA2RDSLeFMu23-XItQAQ38Lv_2AkFAc8wLVuyIRSYXdow&oe=671DABD1&_nc_sid=10d13b","8432"
